Tariff item number,,,Description of goods,Product specific rules
"Section IX Wood and articles of wood; wood charcoal; cork and articles of cork; manufactures of straw, of esparto or of other plaiting materials; basketware and wickerwork (chapter 44-46)",,,,
Chapter 44,,,Wood and articles of wood; wood charcoal,
,44.01,,"Fuel wood, in logs, in billets, in twigs, in faggots or in similar forms; wood in chips or particles; sawdust and wood waste and scrap, whether or not agglomerated in logs, briquettes, pellets or similar forms.",CTH
,44.02,4402,"Wood charcoal (including shell or nut charcoal), whether or not agglomerated.",CTH
,44.03,,"Wood in the rough, whether or not",CTH
,,,,
,,,"stripped of bark or sapwood, or roughly squared.",
,44.04,,"Hoopwood; split poles; piles, pickets and stakes of wood, pointed but not sawn lengthwise; wooden sticks, roughly trimmed but not turned, bent or otherwise worked, suitable for the manufacture of walking-sticks, umbrellas, tool handles or the like; chipwood and the like.",CTH
,44.05,4405,Wood wool; wood flour.,CTH
,44.06,,Railway or tramway sleepers (cross-ties) of wood.,CTH
,44.07,,"Wood sawn or chipped lengthwise, sliced or peeled, whether or not planed, sanded or end-jointed, of a thickness exceeding 6mm.",CTH
,44.08,,"Sheets for veneering (including those obtained by slicing laminated wood), for plywood or for other similar laminated wood and other wood, sawn lengthwise, sliced or peeled, whether or not planed, sanded, spliced or end-jointed, of a thickness not exceeding 6mm.",CTH
,44.09,,"Wood (including strips and friezes for parquet flooring, not assembled) continuously shaped (tongued, grooved, rebated, chamfered, V-jointed, beaded, moulded, rounded or the like) along any of its edges, ends or faces, whether or not planed, sanded or end-jointed.",CTH
,44.1,,"Particle board and similar board (for example, oriented strand board and waferboard) of wood or other ligneous materials, whether or not agglomerated with resins or other organic binding substances.",CTH
,44.11,,"Fibreboard of wood or other ligneous materials, whether or not bonded with resins or other organic substances.",CTH
,44.12,,"Plywood, veneered panels and similar laminated wood.",CTH except from heading 44.07 or 44.08.
,44.13,4413,"Densified wood, in blocks, plates, strips or profile shapes.",CTH
,44.14,4414,"Wooden frames for paintings, photographs, mirrors or similar objects.",CTH
,44.15,,"Packing cases, boxes, crates, drums and similar packings, of wood; cable-drums of wood; pallets, box palletsandother load boards, of wood; pallet",CTH
,,,,
,,,collars of wood.,
,44.16,4416,"Casks, barrels, vats, tubs and other coopers' products and parts thereof, of wood, including staves.",CTH
,44.17,4417,"Tools, tool bodies, tool handles, broom or brush bodies and handles, of wood; boot or shoe lasts and trees, of wood.",CTH
,44.18,,"Builders' joinery and carpentry ofwood, including cellular wood panels, assembled parquet panels, shingles and shakes.",CTH
,44.19,4419,"Tableware and kitchenware, of wood.",CTH
,44.2,,"Wood marquetry and inlaid wood; caskets and cases for jewellery or cutlery, and similar articles, of wood; statuettes and other ornaments, of wood; wooden articles of furniture not falling in
 Chapter 94.",CTH
,44.21,,Other articles of wood.,CTH
Chapter 46,,,"Manufactures of straw, of esparto or of other plaiting materials; basketware
 and wickerwork",
,46.01,,"Plaits and similar products of plaiting materials, whether or not assembled into strips; plaiting materials, plaits and similar products of plaiting materials, bound together in parallel strands or woven, in sheet form, whether or not being finished articles (for example, mats, matting, screens).",
,,4601.2,"- Mats, matting and screens of vegetablematerials","CC except from igusa of subheading
 1401.90."
,,,- Other:,
,,4601.91,-- Of vegetable materials,"CC except from igusa of subheading
 1401.90."
Section XI Textiles and textile articles (chapter 50-63)Note: See the note to this section,,,,
Chapter 50,,,Silk,
,50.01,5001,Silk-worm cocoons suitable for reeling.,CC
,50.02,5002,Raw silk (not thrown).,CTH
,50.03,,"Silk waste (including cocoons unsuitable for reeling, yarn waste and garnetted stock).",CTH
,50.04,5004,Silk yarn (other than yarn spun from silk waste) not put up for retail sale.,CTH
,50.05,5005,"Yarn spun from silk waste, not put up",CTH except
,,,,
,,,for retail sale.,from heading 50.06.
,50.06,5006,"Silk yarn and yarn spun from silk waste, put up for retail sale; silk-worm gut.",CTH except from heading 50.05.
,50.07,,Woven fabrics of silk or of silk waste.,"CTH, provided that, where non- originating materials of heading 50.04 through 50.06 are used, each of the non- originating materials is spun, or dyed or printed entirely in one or more of the Parties; or
 No required CTC, provided that the good is dyed or printed entirely and that the nonoriginating material of heading 50.07 is woven entirely in one or more of the Parties."
Chapter 51,,,"Wool, fine or coarse animal hair; horsehair yarn and woven fabric",
,51.01,,"Wool, not carded or combed.",CC
,51.02,,"Fine or coarse animal hair, not carded or combed.",CC
,51.03,,"Waste of wool or of fine or coarse animal hair, including yarn waste but excluding garnetted stock.",CC
,51.04,5104,Garnetted stock of wool or of fine or coarse animal hair.,CC
,51.05,,"Wool and fine or coarse animal hair, carded or combed (including combed wool in fragments).",CC
,51.06,,"Yarn of carded wool, not put up for retail sale.",CTH outside heading 51.06 through 51.10.
,51.07,,"Yarn of combed wool, not put up for retail sale.",
,,,,
,51.08,,"Yarn of fine animal hair (carded or combed), not put up for retail sale.",
,51.09,,"Yarn of wool or of fine animal hair, put up for retail sale.",
,51.1,5110,"Yarn of coarse animal hair or of horsehair (including gimped horsehair yarn), whether or not put up for retail sale.",
,51.11,,Woven fabrics of carded wool or of carded fine animal hair.,"CTH outside heading 51.11 through 51.13 provided that, where non- originating materials of heading 51.06 through 51.10 are used, each of the non- originating materials is spun, or dyed or printed entirely in one or more of the Parties; or
 No required CTC, provided that the good is dyed or printed entirely and that the nonoriginating material of heading 51.11 through 51.13 is woven entirely in one or more of the Parties."
,51.12,,Woven fabrics of combed wool or of combed fine animal hair.,
,51.13,5113,Woven fabrics of coarse animal hair or of horsehair.,
Chapter 52,,,Cotton,
,52.01,5201,"Cotton, not carded or combed.",CC
,52.02,,Cotton waste (including yarn waste and garnetted stock).,CC
,52.03,5203,"Cotton, carded or combed.",CC
,52.04,,"Cotton sewing thread, whether or not put up for retail sale.","CTH outside heading 52.04 through 52.07, provided that, where non- originating"
,52.05,,"Cotton yarn (other than sewing thread), containing 85% or more by weight of cotton, not put up for retail sale.",
,52.06,,"Cotton yarn (other than sewing thread),",
,,,,
,,,"containing less than 85% by weight of cotton, not put up for retail sale.","materials of heading 52.03 are used, each of the non- originating materials is carded or combed entirely in one or more of the Parties."
,52.07,,Cotton yarn (other than sewing thread) put up for retail sale.,
,52.08,,"Woven fabrics of cotton, containing 85% or more by weight of cotton, weighing not more than 200 g/m2.","CTH outside heading 52.08 through 52.12, provided that, where non- originating materials of heading 52.04 through 52.07 are used, each of the non- originating materials is spun, or dyed or printed entirely in one or more of the Parties; or
 No required CTC, provided that the good is dyed or printed entirely and that the nonoriginating material of heading 52.08 through 52.12 is woven entirely in one or more of the Parties."
,52.09,,"Woven fabrics of cotton, containing 85% or more by weight of cotton, weighing more than 200 g/m2.",
,52.1,,"Woven fabrics of cotton, containing less than 85% by weight of cotton, mixed mainly or solely with man-made fibres, weighing not more than 200 g/m2.",
,52.11,,"Woven fabrics of cotton, containing less than 85% by weight of cotton, mixed mainly or solely with man-made fibres, weighing more than 200 g/m2.",
,52.12,,Other woven fabrics of cotton.,
Chapter 53,,,Other vegetable textile fibres; paper yarn and woven fabrics of paper yarn,
,53.01,,"Flax, raw or processed but not spun; flax tow and waste (including yarn waste and garnetted stock).",CC
,53.02,,"True hemp (Cannabis sativa L.), raw or processed but not spun; tow and waste of true hemp (including yarn waste and",CC
,,,,
,,,garnetted stock).,
,53.03,,"Jute and other textile bast fibres (excluding flax, true hemp and ramie), raw or processed but not spun; tow and waste of these fibres (including yarn waste and garnetted stock).",CC
,53.04,,"Sisal and other textile fibres of the genus Agave, raw or processed but not spun; tow and waste of these fibres (including yarn waste and garnetted stock).",CC
,53.05,,"Coconut, abaca (Manila hemp or Musa textilis Nee), ramie and other vegetable textile fibres, not elsewhere specified or included, raw or processed but not spun; tow, noils and waste of these fibres (including yarn waste and garnetted stock).",CC
,53.06,,Flax yarn.,CTH outside heading 53.06 through 53.08.
,53.07,,Yarn of jute or of other textile bast fibres of heading 53.03.,
,53.08,,Yarn of other vegetable textile fibres; paper yarn.,
,53.09,,Woven fabrics of flax.,"CTH outside heading 53.09 through 53.11, provided that, where non- originating materials of heading 53.06 through 53.08 are used, each of the non- originating materials is spun, or dyed or printed entirely in one or more of the Parties; or
 No required CTC, provided that the good is dyed or printed entirely and that the nonoriginating material of heading 53.09 through 53.11"
,53.1,,Woven fabrics of jute or of other textile bast fibres of heading 53.03.,
,53.11,5311,Woven fabrics of other vegetable textile fibres; woven fabrics of paper yarn.,
,,,,
,,,,is woven entirely in one or more of the Parties.
Chapter 54,,,Man-made filaments,
,54.01,,"Sewing thread of man-made filaments, whether or not put up for retail sale.",CC
,54.02,,"Synthetic filament yarn (other than sewing thread), not put up for retail sale, including synthetic monofilament of less than 67 decitex.",CC
,54.03,,"Artificial filament yarn (other than sewing thread), not put up for retail sale, including artificial monofilament of less than 67 decitex.",CC
,54.04,,"Synthetic monofilament of 67 decitex or more and of which no cross-sectional dimension exceeds 1 mm; strip and the like (for example, artificial straw) of synthetic textile materials of an apparent width not exceeding 5mm.",CC
,54.05,5405,"Artificial monofilament of 67 decitex or more and of which no cross-sectional dimension exceeds 1 mm; strip and the like (for example, artificial straw) of artificial textile materials of an apparent width not exceeding 5mm.",CC
,54.06,,"Man-made filament yarn (other than sewing thread), put up for retail sale.",CC
,54.07,,"Woven fabrics of synthetic filament yarn, including woven fabrics obtained from materials of heading 54.04.","CTH outside heading 54.07 through 54.08, provided that, where non- originating materials of heading 54.01 through 54.06 are used, each of the non- originating materials is spun, or dyed or printed entirely in one or more of the Parties; or
 No required CTC, provided that the good is dyed or printed"
,54.08,,"Woven fabrics of artificial filament yarn, including woven fabrics obtained from materials of heading 54.05.",
,,,,
,,,,entirely and that the nonoriginating material of heading 54.07 through 54.08 is woven entirely in one or more of the Parties.
Chapter 55,,,Man-made staple fibres,
,55.01,,Synthetic filament tow.,CC except from heading 54.01 through 54.06.
,55.02,5502,Artificial filament tow.,CC except from heading 54.01 through 54.06.
,55.03,,"Synthetic staple fibres, not carded, combed or otherwise processed for spinning.",CC except from heading 54.01 through 54.06.
,55.04,,"Artificial staple fibres, not carded, combed or otherwise processed for spinning.",CC except from heading 54.01 through 54.06.
,55.05,,"Waste (including noils, yarn waste and garnetted stock) of man-made fibres.",CC except from heading 54.01 through 54.06.
,55.06,,"Synthetic staple fibres, carded, combed or otherwise processed for spinning.",CC except from heading 54.01 through 54.06.
,55.07,5507,"Artificial staple fibres, carded, combed or otherwise processed for spinning.",CC except from heading 54.01 through 54.06.
,55.08,,"Sewing thread of man-made staple fibres, whether or not put up for retail sale.","CTH outside heading 55.08 through 55.11, provided that, where non- originating materials of heading 55.06 through 55.07 are used, each of the non- originating materials is carded or combed entirely in one or more of the Parties."
,55.09,,"Yarn (other than sewing thread) of synthetic staple fibres, not put up for retail sale.",
,55.1,,"Yarn (other than sewing thread) of artificial staple fibres, not put up for retail sale.",
,55.11,,"Yarn (other than sewing thread) of man-made staple fibres, put up for retail sale.",
,55.12,,"Woven fabrics of synthetic staple fibres, containing 85% or more by weight of synthetic staple fibres.","CTH outside heading 55.12 through 55.16,"
,,,,
,55.13,,"Woven fabrics of synthetic staple fibres, containing less than 85% by weight of such fibres, mixed mainly or solely with cotton, of a weight not exceeding 170g/m２.","provided that, where non- originating materials of heading 55.08 through 55.11 are used, each of the non- originating materials is spun, or dyed or printed entirely in one or more of the Parties; or
 No required CTC, provided that the good is dyed or printed entirely and that the nonoriginating material of heading 55.12 through 55.16 is woven entirely in one or more of the Parties."
,55.14,,"Woven fabrics of synthetic staple fibres, containing less than 85% by weight of such fibres, mixed mainly or solely with cotton, of a weight exceeding 170g/m２.",
,55.15,,Other woven fabrics of synthetic staple fibres.,
,55.16,,Woven fabrics of artificial staple fibres.,
Chapter 56,,,"Wadding, felt and nonwovens; special yarns; twine, cordage, ropes and cables
 and articles thereof",
,56.01,,"Wadding of textile materials and articles thereof; textile fibres, not exceeding 5mm in length (flock), textile dust and mill neps.","CC except from heading 50.04 through 50.07, 51.06 through
 51.13, 52.04 through 52.12, 53.06 through
 53.11, 55.08 through 55.16 or chapter 54."
,56.02,,"Felt, whether or not impregnated, coated, covered or laminated.","CC except from heading 50.04 through 50.07, 51.06 through
 51.13, 52.04 through 52.12, 53.06 through
 53.11, 55.08 through 55.16"
,,,,
,,,,or chapter 54.
,56.03,,"Nonwovens, whether or not impregnated, coated, covered or laminated.",CC except from heading 55.08 through 55.16.
,56.04,,"Rubber thread and cord, textile covered; textile yarn, and strip and the like of heading 54.04 or 54.05, impregnated, coated, covered or sheathed with rubber or plastics.","CC, provided that, where non- originating materials of heading 50.04 through 50.06, 51.06 through
 51.10, 52.04 through 52.07, 53.06 through
 53.08, 54.01 through 54.06, or 55.08 through 55.11 are used, each of the non- originating materials is spun entirely in one or more of the
 Parties."
,56.05,5605,"Metallised yarn, whether or not gimped, being textile yarn, or strip or the like of heading 54.04 or 54.05, combined with metal in the form of thread, strip or powder or covered with metal.","CC, provided that, where non- originating materials of heading 50.04 through 50.06, 51.06 through
 51.10, 52.04 through 52.07, 53.06 through
 53.08, 54.01 through 54.06, or 55.08 through 55.11 are used, each of the non- originating materials is spun entirely in one or more of the
 Parties."
,56.06,5606,"Gimped yarn, and strip and the like of heading 54.04 or 54.05, gimped (other than those of heading 56.05 and gimped","CC, provided that, where non-"
,,,,
,,,horsehair yarn); chenille yarn (including flock chenille yarn); loop wale-yarn.,"originating materials of heading 50.04 through 50.06, 51.06 through
 51.10, 52.04 through 52.07, 53.06 through
 53.08, 54.01 through 54.06, or 55.08 through 55.11 are used, each of the non- originating materials is spun entirely in one or more of the
 Parties."
,56.07,,"Twine, cordage, ropes and cables, whether or not plaited or braided and whether or not impregnated, coated, covered or sheathed with rubber or plastics.","CC, provided that, where non- originating materials of heading 50.04 through 50.06, 51.06 through
 51.10, 52.04 through 52.07, 53.06 through
 53.08, 54.01 through 54.06, or 55.08 through 55.11 are used, each of the non- originating materials is spun entirely in one or more of the
 Parties."
,56.08,,"Knotted netting of twine, cordage or rope; made up fishing nets and other made up nets, of textile materials.","CC, provided that, where non- originating materials of heading 50.04 through 50.06, 51.06 through
 51.10, 52.04 through 52.07,"
,,,,
,,,,"53.06 through
 53.08, 54.01 through 54.06, or 55.08 through 55.11 are used, each of the non- originating materials is spun entirely in one or more of the
 Parties."
,56.09,5609,"Articles of yarn, strip or the like of heading 54.04 or 54.05, twine, cordage, rope or cables, not elsewhere specified or included.","CC, provided that, where non- originating materials of heading 50.04 through 50.06, 51.06 through
 51.10, 52.04 through 52.07, 53.06 through
 53.08, 54.01 through 54.06, or 55.08 through 55.11 are used, each of the non- originating materials is spun entirely in one or more of the
 Parties."
Chapter 57,,,Carpets and other textile floor coverings,"CC, except from heading 50.07, 51.11 through 51.13, 52.08 through
 52.12, 53.09 through 53.11,
 54.07 through
 54.08, or
 55.12 through 55.16, provided that, where non- originating materials of heading 50.04 through 50.06,"
,,,,
,,,,"51.06 through
 51.10, 52.04 through 52.07, 53.06 through
 53.08, 54.01 through 54.06, or 55.08 through 55.11 are used, each of the non- originating materials is spun entirely in one or more of the
 Parties."
Chapter 58,,,Special woven fabrics; tufted textile fabrics; lace; tapestries; trimmings; embroidery,"CC, provided that, where non- originating materials of heading 50.04 through 50.06, 51.06 through
 51.10, 52.04 through 52.07, 53.06 through
 53.08, 54.01 through 54.06, or 55.08 through 55.11 are used, each of the non- originating materials is spun entirely in one or more of the
 Parties."
Chapter 59,,,"Impregnated, coated, covered or laminated textile fabrics; textile articles of a kind suitable for
 industrial use",
,59.01,,"Textile fabrics coated with gum or amylaceous substances, of a kind used for the outer covers of books or the like; tracing cloth; prepared painting canvas; buckram and similar stiffened textile fabrics of a kind used for hat foundations.","CC, except from heading 50.07, 51.11 through 51.13, 52.08 through
 52.12, 53.09 through 53.11,
 54.07 through
 54.08, or
 55.12 through"
,,,,
,,,,55.16.
,59.02,,"Tyre cord fabric of high tenacity yarn of nylon or other polyamides, polyesters or viscose rayon.","CTH, except from heading 50.07, 51.11 through 51.13, 52.08 through
 52.12, 53.09 through 53.11,
 54.07 through
 54.08, or
 55.12 through 55.16, provided that, where non- originating materials of heading 50.04 through 50.06, 51.06 through
 51.10, 52.04 through 52.07, 53.06 through
 53.08, 54.01 through 54.06, or 55.08 through 55.11 are used, each of the non- originating materials is spun entirely in one or more of the
 Parties."
,59.03,,"Textile fabrics impregnated, coated, covered or laminated with plastics, other than those of heading 59.02.","CC, except from heading 50.07, 51.11 through 51.13, 52.08 through
 52.12, 53.09 through 53.11,
 54.07 through
 54.08, or
 55.12 through 55.16, provided that, where non- originating materials of heading 50.04 through 50.06, 51.06 through
 51.10, 52.04"
,,,,
,,,,"through 52.07, 53.06 through
 53.08, 54.01 through 54.06, or 55.08 through 55.11 are used, each of the non- originating materials is spun entirely in one or more of the
 Parties."
,59.04,,"Linoleum, whether or not cut to shape; floor coverings consisting of a coating or covering applied on a textile backing, whether or not cut to shape.","CC, except from heading 50.07, 51.11 through 51.13, 52.08 through
 52.12, 53.09 through 53.11,
 54.07 through
 54.08, or
 55.12 through 55.16, provided that, where non- originating materials of heading 50.04 through 50.06, 51.06 through
 51.10, 52.04 through 52.07, 53.06 through
 53.08, 54.01 through 54.06, or 55.08 through 55.11 are used, each of the non- originating materials is spun entirely in one or more of the
 Parties."
,59.05,5905,Textile wall coverings.,"CC, except from heading 50.07, 51.11 through 51.13, 52.08 through
 52.12, 53.09"
,,,,
,,,,"through 53.11,
 54.07 through
 54.08, or
 55.12 through 55.16, provided that, where non- originating materials of heading 50.04 through 50.06, 51.06 through
 51.10, 52.04 through 52.07, 53.06 through
 53.08, 54.01 through 54.06, or 55.08 through 55.11 are used, each of the non- originating materials is spun entirely in one or more of the
 Parties."
,59.06,,"Rubberised textile fabrics, other than those of heading 59.02.","CC, except from heading 50.07, 51.11 through 51.13, 52.08 through
 52.12, 53.09 through 53.11,
 54.07 through
 54.08, or
 55.12 through 55.16, provided that, where non- originating materials of heading 50.04 through 50.06, 51.06 through
 51.10, 52.04 through 52.07, 53.06 through
 53.08, 54.01 through 54.06, or 55.08 through 55.11 are used, each"
,,,,
,,,,"of the non- originating materials is spun entirely in one or more of the
 Parties."
,59.07,5907,"Textile fabrics otherwise impregnated, coated or covered; painted canvas being theatrical scenery, studio back-cloths or the like.","CC, except from heading 50.07, 51.11 through 51.13, 52.08 through
 52.12, 53.09 through 53.11,
 54.07 through
 54.08, or
 55.12 through 55.16, provided that, where non- originating materials of heading 50.04 through 50.06, 51.06 through
 51.10, 52.04 through 52.07, 53.06 through
 53.08, 54.01 through 54.06, or 55.08 through 55.11 are used, each of the non- originating materials is spun entirely in one or more of the
 Parties."
,59.08,5908,"Textile wicks, woven, plaited or knitted, for lamps, stoves, lighters, candles or the like; incandescent gas mantles and tubular knitted gas mantle fabric therefor, whether or not impregnated.","CC, except from heading 50.07, 51.11 through 51.13, 52.08 through
 52.12, 53.09 through 53.11,
 54.07 through
 54.08, or
 55.12 through 55.16, provided that, where non-"
,,,,
,,,,"originating materials of heading 50.04 through 50.06, 51.06 through
 51.10, 52.04 through 52.07, 53.06 through
 53.08, 54.01 through 54.06, or 55.08 through 55.11 are used, each of the non- originating materials is spun entirely in one or more of the
 Parties."
,59.09,5909,"Textile hosepiping and similar textile tubing, with or without lining, armour or accessories of other materials.","CC, except from heading 50.07, 51.11 through 51.13, 52.08 through
 52.12, 53.09 through 53.11,
 54.07 through
 54.08, or
 55.12 through 55.16, provided that, where non- originating materials of heading 50.04 through 50.06, 51.06 through
 51.10, 52.04 through 52.07, 53.06 through
 53.08, 54.01 through 54.06, or 55.08 through 55.11 are used, each of the non- originating materials is spun entirely in one or more of the
 Parties."
,,,,
,59.1,5910,"Transmission or conveyor belts or belting, of textile material, whether or not impregnated, coated, covered or laminated with plastics, or reinforced with metal or other material.","CTH, except from heading 50.07, 51.11 through 51.13, 52.08 through
 52.12, 53.09 through 53.11,
 54.07 through
 54.08, or
 55.12 through 55.16, provided that, where non- originating materials of heading 50.04 through 50.06, 51.06 through
 51.10, 52.04 through 52.07, 53.06 through
 53.08, 54.01 through 54.06, or 55.08 through 55.11 are used, each of the non- originating materials is spun entirely in one or more of the
 Parties."
,59.11,,"Textile products and articles, for technical uses, specified in Note 7 to this Chapter.","CC, except from heading 50.07, 51.11 through 51.13, 52.08 through
 52.12, 53.09 through 53.11,
 54.07 through
 54.08, or
 55.12 through 55.16, provided that, where non- originating materials of heading 50.04 through 50.06, 51.06 through
 51.10, 52.04 through 52.07,"
,,,,
,,,,"53.06 through
 53.08, 54.01 through 54.06, or 55.08 through 55.11 are used, each of the non- originating materials is spun entirely in one or more of the
 Parties."
Chapter 60,,,Knitted or crocheted fabrics,"CC, provided that, where non- originating materials of heading 50.04 through 50.06, 51.06 through
 51.10, 52.04 through 52.07, 53.06 through
 53.08, 54.01 through 54.06, or 55.08 through 55.11 are used, each of the non- originating materials is spun, or dyed or printed entirely in one or more of the Parties; or
 No required CTC, provided that the good is dyed or printed entirely and that the nonoriginating material of chapter 60 is knitted or crocheted entirely in one or more of the Parties."
,,,,
Chapter 61,,,"Articles of apparel and clothing accessories, knitted or crocheted","CC, provided that, where non- originating materials of heading 50.07, 51.11 through
 51.13, 52.08 through 52.12, 53.09 through
 53.11, 54.07 through 54.08. 55.12 through 55.16 or chapter 60 are used, each of the non- originating materials is knitted or crocheted entirely in one or more of the Parties."
Chapter 62,,,"Articles of apparel and clothing accessories, not knitted or crocheted",
