Tariff item number,,,Description of goods,Product specific rules
Section I Live animals; animal products (Chapter 1-5),,,,
Chapter 1,,,Live animals,CC
Chapter 2,,,Meat and edible meat offal,CC except from Chapter 1.
Chapter 3,,,"Fish and crustaceans, mollusks and other aquatic invertebrates",CC
Chapter 4,,,"Dairy produce; birds’ eggs; natural honey; edible products of animal origin, not elsewhere specified or included",CC
Chapter 5,,,"Products of animal origin, not elsewhere specified or included",CC
Section II Vegetable products (Chapter 6-14),,,,
Chapter 6,,,"Live trees and other plants; bulbs, roots and the like; cut flowers and
 ornamental foliage",CC
Chapter 7,,,Edible vegetables and certain roots and tubers,CC
Chapter 8,,,Edible fruit and nuts; peel of citrus fruit or melons,
,8.01,,"Coconuts, Brazil nuts and cashew nuts, fresh or dried, whether or not shelled or peeled.",
,,,- Coconuts:,
,,801.11,-- Desiccated,CC
,,801.19,-- Other,CC
,,,- Brazil nuts:,
,,801.21,-- In shell,CC
,,801.22,-- Shelled,CC
,,,- Cashew nuts:,
,,801.31,-- In shell,CC
,,801.32,-- Shelled,CTSH
,8.02,,"Other nuts, fresh or dried, whether or not shelled or peeled.",CC
,8.03,803,"Bananas, including plantains, fresh or dried.",CC
,8.04,,"Dates, figs, pineapples, avocados, guavas, mangoes and mangosteens, fresh or dried.",CC
,8.05,,"Citrus fruit, fresh or dried.",CC
,8.06,,"Grapes, fresh or dried.",CC
,8.07,,"Melons (including watermelons) and papaws (papayas), fresh.",CC
,8.08,,"Apples, pears and quinces, fresh.",CC
,8.09,,"Apricots, cherries, peaches (including nectarines), plums and sloes, fresh.",CC
,,,,
,8.1,,"Other fruit, fresh.",CC
,8.11,,"Fruit and nuts, uncooked or cooked by steaming or boiling in water, frozen, whether or not containing added sugar or other sweetening matter.",CC
,8.12,,"Fruit and nuts, provisionally preserved (for example, by sulphur dioxide gas, in brine, in sulphur water or in other preservative solutions), but unsuitable in that state for immediate consumption.",CC
,8.13,,"Fruit, dried, other than that of headings 08.01 to 08.06; mixtures of nuts or dried fruits of this Chapter.",CC
,8.14,814,"Peel of citrus fruit or melons (including watermelons), fresh, frozen, dried or provisionally preserved inbrine, in sulphur water or in other preservative solutions.",CC
Chapter 9,,,"Coffee, tea, maté and spices",
,9.01,,"Coffee, whether or not roasted or decaffeinated; coffee husks and skins; coffee substitutes containing coffee in any proportion.",CC
,9.02,,"Tea, whether or not flavored.",CC
,9.03,903,Maté.,CC
,9.04,,Pepper of the genusPiper; dried or crushed or ground fruits of the genus Capsicum or the genus Pimenta.,CC
,9.05,905,Vanilla.,CC
,9.06,,Cinnamon and cinnamon-tree flowers.,CC
,9.07,907,"Cloves (whole fruit, cloves and stems).",CC
,9.08,,"Nutmeg, mace and cardamoms.",CC
,9.09,,"Seeds of anise, badian, fennel, coriander, cumin or caraway; juniper berries.",CC
,9.1,,"Ginger, saffron, turmeric (curcuma), thyme, bay leaves, curry and other spices.",
,,910.1,- Ginger,CC
,,910.2,- Saffron,CC
,,910.3,- Turmeric (curcuma),CC
,,,- Other spices：,
,,910.91,-- Mixtures referred to in Note 1(b) to this Chapter,CC
,,910.99,-- Other,"CTSH for
 Curry. CC for any other good."
Chapter 10,,,Cereals,CC
Chapter 11,,,Products of the milling industry; malt; starches; inulin; wheat gluten,
,,,,
,11.01,1101,Wheat or meslin flour.,CC
,11.02,,Cereal flours other than of wheat or meslin.,CC
,11.03,,"Cereal groats, meal and pellets.",CC
,11.04,,"Cereal grains otherwise worked (for example, hulled, rolled, flaked, pearled, sliced or kibbled), except rice of heading 10.06; germ of cereals, whole, rolled, flaked or ground.",CC
,11.05,,"Flour, meal, powder, flakes, granules and pellets of potatoes.",CC except from Chapter 7.
,11.06,,"Flour, meal and powder of the dried leguminous vegetables of heading 07.13, of sago or of roots or tubers of heading
 07.14 or of the products of Chapter 8.",
,,1106.1,- Of the dried leguminous vegetables of heading 07.13,CC
,,1106.2,"- Of sago or of roots or tubers of heading
 07.14",CC except from Chapter 7.
,,1106.3,- Of the products of Chapter 8,CC except from Chapter 8.
,11.07,,"Malt, whether or not roasted.",CC
,11.08,,Starches; inulin.,CC
,11.09,1109,"Wheat gluten, whether or not dried.",CC
Chapter 12,,,"Oil seeds and oleaginous fruits; miscellaneous grains, seeds and fruit; industrial or medicinal plants; straw and fodder",CC
Chapter 13,,,"Lac; gums, resins and other vegetable saps and extracts",CC
Chapter 14,,,"Vegetable plaiting materials; vegetable products not elsewhere
 specified or included",CC
Section III Animal or vegetable fats and oils and their cleavage products; prepared edible fats; animal or vegetable waxes (Chapter 15),,,,
Chapter 15,,,Animal or vegetable fats and oils and their cleavage products; prepared edible fats; animal or vegetable waxes,
,15.01,1501,"Pig fat (including lard) and poultry fat, other than that of heading 02.09 or 15.03.",CC
,15.02,1502,"Fats of bovine animals, sheep or goats, other than those of heading 15.03.",CC
,15.03,1503,"Lard stearin, lard oil, oleostearin, oleo-oil and tallow oil, not emulsified or mixed or otherwise prepared.",CC
,15.04,,"Fats and oils and their fractions, of fish or marine mammals, whether or not refined, but not chemically modified.",CC
,15.05,1505,Wool grease and fatty substances derived therefrom (including lanolin).,CC
,15.06,1506,Other animal fats and oils and their,CC
,,,,
,,,"fractions, whether or not refined, but not chemically modified.",
,15.07,,"Soya-bean oil and its fractions, whether or not refined, but not chemically modified.",
,,1507.1,"- Crude oil, whether or not degummed",CC
,,1507.9,- Other,CTSH
,15.08,,"Ground-nut oil and its fractions, whether or not refined, but not chemically modified.",CC
,15.09,,"Olive oil and its fractions, whether or not refined, but not chemically modified.",
,,1509.1,- Virgin,CC
,,1509.9,- Other,CTSH
,15.1,1510,"Other oils and their fractions, obtained solely from olives, whether or not refined, but not chemically modified, including blends of these oils or fractions with oils or fractions of heading 15.09.",CC
,15.11,,"Palm oil and its fractions, whether or not refined, but not chemically modified.",
,,1511.1,- Crude oil,CC
,,1511.9,- Other,CTSH
,15.12,,"Sunflower-seed, safflower or cotton-seed oil and fractions thereof, whether or not refined, but not chemically modified.",CC
,15.13,,"Coconut (copra), palm kernel or babassu oil and fractions thereof, whether or not refined, but not chemically modified.",
,,,- Coconut (copra) oil and its fractions:,
,,1513.11,-- Crude oil,CC
,,1513.19,-- Other,CTSH
,,,- Palm kernel or babassu oil and fractions thereof:,
,,1513.21,-- Crude oil,CC
,,1513.29,-- Other,CTSH
,15.14,,"Rape, colza or mustard oil and fractions thereof, whether or not refined, but not chemically modified.",CC
,15.15,,"Other fixed vegetable fats and oils (including jojoba oil) and their fractions, whether or not refined, but not chemically modified.",
,,,- Linseed oil and its fractions:,
,,1515.11,-- Crude oil,CC
,,1515.19,-- Other,CC
,,,- Maize (corn) oil and its fractions:,
,,,,
,,1515.21,-- Crude oil,CC
,,1515.29,-- Other,CC
,,1515.3,- Castor oil and its fractions,CTSH
,,1515.5,- Sesame oil and its fractions,CC
,,1515.9,- Other,CTSH for Tung oil and its fractions. CC for any other goods.
,15.16,,"Animal or vegetable fats and oils and their fractions, partly or wholly hydrogenated, inter-esterified, re-esterified or elaidinized, whether or not refined, but not further prepared.",CTH
,15.17,,"Margarine; edible mixtures or preparations of animal or vegetable fats or oils or of fractions of different fats or oils of this Chapter, other than edible fats or oils or their fractions of heading 15.16.",CTH
,15.18,1518,"Animal or vegetable fats and oils and their fractions, boiled, oxidized, dehydrated, sulphurized, blown, polymerized by heat in vacuum or in inert gas or otherwise chemically modified, excluding those of heading
 15.16; inedible mixtures or preparations of animal or vegetable fats or oils or of fractions of different fats or oils of this Chapter, not elsewhere specified or included.",CTH
,15.2,1520,"Glycerol, crude; glycerol waters and glycerol lyes.",CTH
,15.21,,"Vegetable waxes (other than triglycerides), beeswax, other insect waxes and spermaceti, whether or not refined or colored.",CTH
,15.22,1522,Degras; residues resulting from the treatment of fatty substances or animal or vegetable waxes.,CTH
"Section IV Prepared foodstuffs; beverages, spirits and vinegar; tobacco and
 manufactured tobacco substitutes (Chapter 16-24)",,,,
Chapter 16,,,"Preparations of meat, of fish or of crustaceans, mollusks or other aquatic invertebrates",
,16.01,1601,"Sausages and similar products, of meat, meat offal or blood; food preparations based on these products.",CC except from Chapter 1 or 2.
,16.02,,"Other prepared or preserved meat, meat offal or blood.",
,,1602.1,- Homogenized preparations,CC except from
,,,,
,,,,Chapter 1 or 2.
,,1602.2,- Of liver of any animal,CC except from Chapter 1 or 2.
,,,- Of poultry of heading 01.05:,
,,1602.31,-- Of turkeys,CC except from Chapter 1 or 2.
,,1602.32,-- Of fowls of the species Gallus domesticus,CC
,,1602.39,-- Other,CC
,,,- Of swine:,
,,1602.41,-- Hams and cuts thereof,CC except from Chapter 1 or 2.
,,1602.42,-- Shoulders and cuts thereof,CC except from Chapter 1 or 2.
,,1602.49,"-- Other, including mixtures",CC except from Chapter 1 or 2.
,,1602.5,- Of bovine animals,CC except from Chapter 1 or 2.
,,1602.9,"- Other, including preparations of blood of any animal",CC
,16.03,1603,"Extracts and juices of meat, fish or crustaceans, mollusks or other aquatic invertebrates.",CC
,16.04,,Prepared or preserved fish; caviar and caviar substitutes prepared from fish eggs.,
,,,"- Fish, whole or in pieces, but not minced:",
,,1604.11,-- Salmon,CC except from Chapter 3.
,,1604.12,-- Herrings,CC except from Chapter 3.
,,1604.13,"-- Sardines, sardinella and brisling or sprats",CC except from Chapter 3.
,,1604.14,"-- Tunas, skipjack and bonito (Sarda spp.)",CC except from Chapter 3.
,,1604.15,-- Mackerel,CC except from Chapter 3.
,,1604.16,-- Anchovies,CC except from Chapter 3.
,,1604.19,-- Other,CC except from Chapter 3.
,,1604.2,- Other prepared or preserved fish,CC except from Chapter 3.
,,1604.3,- Caviar and caviar substitutes,CC
,16.05,,"Crustaceans, mollusks and other aquatic invertebrates, prepared or preserved.",
,,1605.1,- Crab,CC except from Chapter 3.
,,1605.2,- Shrimps and prawns,CC
,,1605.3,- Lobster,CC except from
,,,,
,,,,Chapter 3.
,,1605.4,- Other crustaceans,CC
,,1605.9,- Other,CC except from Chapter 3.
Chapter 17,,,Sugars and sugar confectionery,
,17.01,,"Cane or beet sugar and chemically pure sucrose, in solid form.",CC except from Chapter 12.
,17.02,,"Other sugars, including chemically pure lactose, maltose, glucose and fructose, in solid form; sugar syrups not containing added flavoring or coloring matter; artificial honey, whether or not mixed with natural honey; caramel.",
,,,- Lactose and lactose syrup:,
,,1702.11,"-- Containing by weight 99 % or more lactose, expressed as anhydrous lactose, calculated on the dry matter",CC except from Chapter 4.
,,1702.19,-- Other,CC except from Chapter 4.
,,1702.2,- Maple sugar and maple syrup,CC
,,1702.3,"- Glucose and glucose syrup, not containing fructose or containing in the dry state less than 20 % by weight of fructose",CC
,,1702.4,"- Glucose and glucose syrup, containing in the dry state at least 20 % but less than 50 % by weight of fructose,
 excluding invert sugar",CC
,,1702.5,- Chemically pure fructose,CC except from Chapter 11 or 12.
,,1702.6,"- Other fructose and fructose syrup, containing in the dry state more than 50 % by weight of fructose, excluding invert sugar",CC except from Chapter 11 or 12.
,,1702.9,"- Other, including invert sugar and other sugar and sugar syrup blends containing in the dry state 50 % by
 weight of fructose",CC
,17.03,,Molasses resulting from the extraction or refining of sugar.,CC except from Chapter 12.
,17.04,,"Sugar confectionery (including white chocolate), not containing cocoa.",CC
Chapter 18,,,Cocoa and cocoa preparations,CC
Chapter 19,,,"Preparations of cereals, flour, starch or milk; pastrycooks’ products",
,19.01,,"Malt extract; food preparations of flour, groats, meal, starch or malt extract, not containing cocoa or containing less than 40 % by weight of cocoa calculated on a totally defatted",CC
,,,,
,,,"basis, not elsewhere specified or included; food preparations of goods of headings 04.01 to 04.04, not containing cocoa or containing less than 5 % by weight of cocoa calculated on a totally defatted basis, not elsewhere specified of included.",
,19.02,,"Pasta, whether or not cooked or stuffed (with meat or other substances) or otherwise prepared, such as spaghetti, macaroni, noodles, lasagna, gnocchi, ravioli, cannelloni; couscous, whether or not prepared.",CC
,19.03,1903,"Tapioca and substitutes therefor prepared from starch, in the form of flakes, grains, pearls, siftings or in similar forms.",CC except from Chapter 11.
,19.04,,"Prepared foods obtained by the swelling or roasting of cereals or cereal products (for example, corn flakes); cereals (other than maize (corn)) in grain form or in the form of flakes or other worked grains (except flour, groats and meal), pre-cooked or otherwise prepared, not elsewhere specified or included.",CC
,19.05,,"Bread, pastry, cakes, biscuits and other bakers’ wares, whether or not containing cocoa; communion wafers, empty cachets of a kind suitable for pharmaceutical use, sealing wafers, rice paper and similar products.",
,,1905.1,- Crispbread,CC except from Chapter 11.
,,1905.2,- Gingerbread and the like,CC except from Chapter 11.
,,,- Sweet biscuits; waffles and wafers:,
,,1905.31,-- Sweet biscuits,CC
,,1905.32,-- Waffles and wafers,CC
,,1905.4,"- Rusks, toasted bread and similar toasted products",CC except from Chapter 11.
,,1905.9,- Other,CC except from Chapter 11.
Chapter 20,,,"Preparations of vegetables, fruit, nuts or other parts of plants",
,20.01,,"Vegetables, fruit, nuts and other edible parts of plants, prepared or preserved by vinegar or acetic acid.",CC except from Chapter 7 or 8.
,20.02,,Tomatoes prepared or preserved otherwise than by vinegar or acetic acid.,CC except from Chapter 7.
,20.03,,"Mushrooms and truffles, prepared or",CC except from
,,,,
,,,preserved otherwise than by vinegar or acetic acid.,Chapter 7.
,20.04,,"Other vegetables prepared or preserved otherwise than by vinegar or acetic acid, frozen, other than products of heading 20.06.",CC except from Chapter 7.
,20.05,,"Other vegetables prepared or preserved otherwise than by vinegar or acetic acid, not frozen, other than products of heading 20.06.",CC except from Chapter 7.
,20.06,2006,"Vegetables, fruit, nuts, fruit-peel and other parts of plants, preserved by
 sugar (drained, glacé or crystallized).",CC except from Chapter 7 or 8.
,20.07,,"Jams, fruit jellies, marmalades, fruit or nut purée and fruit or nut pastes, obtained by cooking, whether or not containing added sugar or other sweetening matter.",
,,2007.1,- Homogenized preparations,CC except from Chapter 8.
,,,- Other:,
,,2007.91,-- Citrus fruit,CC except from Chapter 8.
,,2007.99,-- Other,CC except from Chapter 7 or 8.
,20.08,,"Fruit, nuts and other edible parts of plants, otherwise prepared or preserved, whether or not containing added sugar or other sweetening matter or spirit, not elsewhere specified or included.",
,,,"- Nuts, ground-nuts and other seeds, whether or not mixed together:",
,,2008.11,-- Ground-nuts,CC except from Chapter 12.
,,2008.19,"-- Other, including mixtures",CC except from Chapter 8.
,,2008.2,- Pineapples,CC except from Chapter 8.
,,2008.3,- Citrus fruit,CC except from Chapter 8.
,,2008.4,- Pears,CC except from Chapter 8.
,,2008.5,- Apricots,CC except from Chapter 8.
,,2008.6,- Cherries,CC except from Chapter 8.
,,2008.7,"- Peaches, including nectarines",CC except from Chapter 8.
,,2008.8,- Strawberries,CC except from Chapter 8.
,,,,
,,,"- Other, including mixtures other than those of subheading 2008.19:",
,,2008.91,-- Palm hearts,CC except from Chapter 8.
,,2008.92,-- Mixtures,CC except from Chapter 8.
,,2008.99,-- Other,CC except from Chapter 7 or 8.
,20.09,,"Fruit juices (including grape must) and vegetable juices, unfermented and not containing added spirit, whether or not containing added sugar or other sweetening matter.",
,,,- Orange juice:,
,,2009.11,-- Frozen,CC
,,2009.12,"-- Not frozen, of a Brix value not exceeding 20",CC
,,2009.19,-- Other,CC
,,,- Grapefruit (including pomelo) juice:,
,,2009.21,-- Of a Brix value not exceeding 20,CC
,,2009.29,-- Other,CC
,,,- Juice of any other single citrus fruit:,
,,2009.31,-- Of a Brix value not exceeding 20,CC
,,2009.39,-- Other,CC
,,,- Pineapple juice:,
,,2009.41,-- Of a Brix value not exceeding 20,CC except from Chapter 8.
,,2009.49,-- Other,CC except from Chapter 8.
,,2009.5,- Tomato juice,CC except from Chapter 7.
,,,- Grape juice (including grape must):,
,,2009.61,-- Of a Brix value not exceeding 30,CC
,,2009.69,-- Other,CC
,,,- Apple juice:,
,,2009.71,-- Of a Brix value not exceeding 20,CC
,,2009.79,-- Other,CC
,,2009.8,"- Juice of any other single fruit or
 vegetable",CC
,,2009.9,- Mixture of Juices,CC except from Chapter 7 or 8.
Chapter 21,,,Miscellaneous edible preparations,
,21.01,,"Extracts, essences and concentrates, of coffee, tea or maté and preparations with a basis of these products or with a basis of coffee, tea or maté; roasted chicory and other roasted coffee substitutes, and extracts, essences and concentrates thereof.",
,,,"- Extracts, essences and concentrates of coffee, and preparations with a",
,,,,
,,,"basis of these extracts, essences or concentrates or with a basis of coffee:",
,,2101.11,"-- Extracts, essences and concentrates",CC
,,2101.12,"-- Preparations with a basis of extracts, essences or concentrates or with a basis of coffee",CC
,,2101.2,"- Extracts, essences and concentrates, of tea or maté, and preparations with a basis of these extracts, essences or concentrates or with a basis of tea or maté",CC
,,2101.3,"- Roasted chicory and other roasted coffee substitutes, and extracts, essences and concentrates thereof",CC except from Chapter 10 or 19.
,21.02,,"Yeasts (active or inactive); other single-cell micro-organisms, dead (but not including vaccines of heading 30.02); prepared baking powders.",CC
,21.03,,Sauces and preparations therefor; mixed condiments and mixed seasonings; mustard flour and meal and prepared mustard.,
,,2103.1,- Soya sauce,CC
,,2103.2,"- Tomato ketchup and other tomato
 sauces",CC except from Chapter 7 or 20.
,,2103.3,- Mustard flour and meal and prepared mustard,CC
,,2103.9,- Other,CC
,21.04,,Soups and broths and preparations therefor; homogenized composite food preparations.,CC
,21.05,2105,"Ice cream and other edible ice, whether or not containing cocoa.",CC
,21.06,,Food preparations not elsewhere specified or included.,
,,2106.1,- Protein concentrates and textured protein substances,CC
,,2106.9,- Other,LVC 40%
Chapter 22,,,"Beverages, spirits and vinegar",
,22.01,,"Waters, including natural or artificial mineral waters and aerated waters, not containing added sugar or other sweetening matter nor flavored; ice and snow.",CC
,22.02,,"Waters, including mineral waters and aerated waters, containing added sugar or other sweetening matter or flavored, and other non-alcoholic beverages, not including fruit or vegetable juices of heading 20.09.",
,,,,
,,2202.1,"- Waters, including mineral waters and aerated waters, containing added sugar or other sweetening matter or flavored",CC
,,2202.9,- Other,LVC 40%
,22.03,2203,Beer made from malt.,CTH
,22.04,,"Wine of fresh grapes, including fortified wines;grape must other than that of heading 20.09.",CC
,22.05,,Vermouth and other wine of fresh grapes flavored with plants or aromatic substances.,CC
,22.06,2206,"Other fermented beverages (for example, cider, perry, mead); mixtures of fermented beverages and mixtures of fermented beverages and non-alcoholic beverages, not elsewhere specified or included.",CC
,22.07,,"Undenatured ethyl alcohol of an alcoholic strength by volume of 80% vol or higher; ethyl alcohol and other spirits, denatured, of any strength.",CC
,22.08,,"Undenatured ethyl alcohol of an alcoholic strength by volume of less than 80% vol; spirits, liqueurs and other spirituous beverages.",
,,2208.2,- Spirits obtained by distilling grape wine or grape marc,LVC 40% or CC
,,2208.3,- Whiskies,LVC 40% or CC
,,2208.4,- Rum and other spirits obtained by distilling fermented sugarcane products,LVC 40% or CC
,,2208.5,- Gin and Geneva,LVC 40% or CC
,,2208.6,- Vodka,LVC 40% or CC
,,2208.7,- Liqueurs and cordials,LVC 40%or CC
,,2208.9,- Other,"LVC 40% and CTH for sake compound or cooking sake (Mirin).
 CC except from Chapter 8 or 20 for beverage with a basis of fruits, of an alcoholic strength by volume of less than 1 %. CTH except from heading 22.07 for any"
,,,,
,,,,other good.
,22.09,2209,Vinegar and substitutes for vinegar obtained from acetic acid.,CC
Chapter 23,,,Residues and waste from the food industries; prepared animal fodder,
,23.01,,"Flours, meals and pellets, of meat or meat offal, of fish or of crustaceans, mollusks or other aquatic invertebrates, unfit for human consumption; greaves.",CTH
,23.02,,"Bran, sharps and other residues, whether or not in the form of pellets, derived from the sifting, milling or other working of cereals or of leguminous plants.",CTH
,23.03,,"Residues of starch manufacture and similar residues, beet-pulp, bagasse and other waste of sugar manufacture, brewing or distilling dregs and waste, whether or not in the form of pellets.",CTH
,23.04,2304,"Oil-cake and other solid residues, whether or not ground or in the form of pellets, resulting from the extraction of soya-bean oil.",CTH
,23.05,2305,"Oil-cake and other solid residues, whether or not ground or in the form of pellets, resulting from the extraction of ground-nut oil.",CTH
,23.06,,"Oil-cake and other solid residues, whether or not ground or in the form of pellets, resulting from the extraction of vegetable fats or oils, other than those of heading 23.04 or 23.05.",CTH
,23.07,2307,Wine lees; argol.,CTH
,23.08,2308,"Vegetable materials and vegetable waste, vegetable residues and by-products, whether or not in the form of pellets, of a kind used in animal feeding, not elsewhere specified or included.",CTH
,23.09,,Preparations of a kind used in animal feeding.,LVC 40%
Chapter 24,,,"Tobacco and manufactured tobacco
 substitutes",
,24.01,,Unmanufactured tobacco; tobacco refuse.,
,,2401.1,"- Tobacco, not stemmed/stripped",CC
,,2401.2,"- Tobacco, partly or wholly stemmed/stripped",CC
,,2401.3,- Tobacco refuse,CTSH
,24.02,,"Cigars, cheroots, cigarillos and cigarettes, of tobacco or of tobacco substitutes.",CTH
,24.03,,Other manufactured tobacco and manufactured tobacco substitutes; “homogenized” or “reconstituted” tobacco; tobacco extracts and essences.,CTH
Section V Mineral products (Chapter 25-27),,,,
Chapter 25,,,Salt; sulphur; earths and stone;,
,,,,
,,,,
,,,"plastering materials, lime and cement",
,25.01,2501,"Salt (including table salt and denatured salt) and pure sodium chloride, whether or not in aqueous solution or containing added anti-caking or free-flowing agents; sea water.",CC
,25.02,2502,Unroasted iron pyrites.,CC
,25.03,2503,"Sulphur of all kinds, other than sublimed sulphur, precipitated sulphur and colloidal sulphur.",CC
,25.04,,Natural graphite.,CC
,25.05,,"Natural sands of all kinds, whether or not colored, other than metalbearing sands of Chapter 26.",CC
,25.06,,"Quartz (other than natural sands); quartzite, whether or not roughly trimmed or merely cut, by sawing or otherwise, into blocks or slabs of a rectangular (including square) shape.",CC
,25.07,2507,"Kaolin and other kaolinic clays, whether or not calcined.",CC
,25.08,,"Other clays (not including expanded clays of heading 68.06), andalusite, kyanite and sillimanite, whetheror not calcined; mullite; chamotte or dinas earths.",CC
,25.09,2509,Chalk.,CC
,25.17,,"Pebbles, gravel, broken or crushed stone, of a kind commonly used for concrete aggregates, for road metalling or for railway or other ballast, shingle and flint, whether or not heat-treated; macadam of slag, dross or similar industrial waste, whether or not incorporating the materials cited in the first part of the heading; tarred macadam; granules, chippings and powder, of stones of heading 25.15 or 25.16, whether or not heat-treated.",
,,2517.2,"- Macadam of slag, dross or similar industrial waste, whether or not incorporating the materials cited in
 subheading 2517.10",CC
,,2517.3,- Tarred macadam,CC
,,,"- Granules, chippings and powder, of stones of heading 25.15 or 25.16, whether or not heat-treatment:",
,,2517.41,-- Of marble,CC
,,2517.49,-- Other,CC
,25.18,,"Dolomite, whether or not calcined or sintered, including dolomite roughly trimmed or merely cut, by sawing or otherwise, into blocks or slabs of a rectangular (including square) shape; dolomite ramming mix.",CC
,25.19,,"Natural magnesium carbonate
 (magnesite); fused magnesia; dead-burned (sintered) magnesia, whether or not containing small quantities of other oxides added before sintering; other magnesium oxide, whether or not pure.",CC
,,,,
,25.2,,"Gypsum; anhydrite; plasters (consisting of calcined gypsum or calcium sulphate) whether or not colored, with or without small quantities of accelerators or retarders.",
,,2520.1,- Gypsum; anhydrite,CC
,,2520.2,- Plasters,CTSH
,25.21,2521,"Limestone flux; limestone and other calcareousstone, of a kind used for the manufacture of lime or cement.",CC
,25.24,,Asbestos.,CC
,25.25,,"Mica, including splittings; mica waste.",
,,2525.1,- Crude mica and mica rifted into sheets or splittings,CC
,,2525.2,- Mica powder,CC
,,2525.3,- Mica waste,WO
